{"schema_version":"1","analysis_rev":"fx-0001","producer_commit":"w0-fixture","input_artifact_hashes":{},"trip_id":"fl-pie-fixture-01","chunk_t0_ms":0,"frames":[{"t_ms":0,"ego":{"lat":43.6487,"lon":-79.3983,"heading":72.0,"sigma_m":3.0,"state":"observed"},"peds":[],"vehs":[],"buildings":[{"bid":"w1001","u0":197.8,"u1":265.4},{"bid":"w1002","u0":350.5,"u1":369.1}]},{"t_ms":100,"ego":{"lat":43.6487022,"lon":-79.3982906,"heading":72.0,"sigma_m":3.0,"state":"interpolated"},"peds":[],"vehs":[],"buildings":[{"bid":"w1001","u0":193.0,"u1":264.4},{"bid":"w1002","u0":350.8,"u1":369.9}]},{"t_ms":200,"ego":{"lat":43.6487044,"lon":-79.3982811,"heading":72.0,"sigma_m":3.0,"state":"interpolated"},"peds":[],"vehs":[],"buildings":[{"bid":"w1001","u0":187.8,"u1":263.4},{"bid":"w1002","u0":351.1,"u1":370.7}]},{"t_ms":300,"ego":{"lat":43.6487067,"lon":-79.3982717,"heading":72.0,"sigma_m":3.0,"state":"interpolated"},"peds":[],"vehs":[],"buildings":[{"bid":"w1001","u0":182.1,"u1":262.3},{"bid":"w1002","u0":351.5,"u1":371.6}]},{"t_ms":400,"ego":{"lat":43.6487089,"lon":-79.3982622,"heading":72.0,"sigma_m":3.0,"state":"interpolated"},"peds":[],"vehs":[],"buildings":[{"bid":"w1001","u0":176.1,"u1":261.2},{"bid":"w1002","u0":351.8,"u1":372.5}]},{"t_ms":500,"ego":{"lat":43.6487111,"lon":-79.3982528,"heading":72.0,"sigma_m":3.0,"state":"observed"},"peds":[],"vehs":[],"buildings":[{"bid":"w1001","u0":169.5,"u1":260.0},{"bid":"w1002","u0":352.1,"u1":373.4}]},{"t_ms":600,"ego":{"lat":43.6487133,"lon":-79.3982433,"heading":72.0,"sigma_m":3.0,"state":"interpolated"},"peds":[],"vehs":[],"buildings":[{"bid":"w1001","u0":162.3,"u1":258.8},{"bid":"w1002","u0":352.5,"u1":374.4}]},{"t_ms":700,"ego":{"lat":43.6487155,"lon":-79.3982339,"heading":72.0,"sigma_m":3.0,"state":"interpolated"},"peds":[],"vehs":[],"buildings":[{"bid":"w1001","u0":154.5,"u1":257.5},{"bid":"w1002","u0":352.8,"u1":375.4}]},{"t_ms":800,"ego":{"lat":43.6487178,"lon":-79.3982244,"heading":72.0,"sigma_m":3.0,"state":"interpolated"},"peds":[],"vehs":[],"buildings":[{"bid":"w1001","u0":145.9,"u1":256.2},{"bid":"w1002","u0":353.2,"u1":376.4}]},{"t_ms":900,"ego":{"lat":43.64872,"lon":-79.398215,"heading":72.0,"sigma_m":3.0,"state":"interpolated"},"peds":[],"vehs":[],"buildings":[{"bid":"w1001","u0":136.6,"u1":254.9},{"bid":"w1002","u0":353.6,"u1":377.4}]},{"t_ms":1000,"ego":{"lat":43.6487222,"lon":-79.3982055,"heading":72.0,"sigma_m":3.0,"state":"observed"},"peds":[],"vehs":[],"buildings":[{"bid":"w1001","u0":126.4,"u1":253.5},{"bid":"w1002","u0":353.9,"u1":378.6}]},{"t_ms":1100,"ego":{"lat":43.6487244,"lon":-79.3981961,"heading":72.0,"sigma_m":3.0,"state":"interpolated"},"peds":[],"vehs":[],"buildings":[{"bid":"w1001","u0":115.2,"u1":252.0},{"bid":"w1002","u0":354.3,"u1":379.7}]},{"t_ms":1200,"ego":{"lat":43.6487266,"lon":-79.3981867,"heading":72.0,"sigma_m":3.0,"state":"interpolated"},"peds":[],"vehs":[{"entity_id":"V1","x":58.4,"y":3.5,"yaw":3.1416,"cls":"car","dims":[4.5,1.8,1.5],"sigma_m":3.92}],"buildings":[{"bid":"w1001","u0":102.8,"u1":250.4},{"bid":"w1002","u0":354.7,"u1":380.9}]},{"t_ms":1300,"ego":{"lat":43.6487289,"lon":-79.3981772,"heading":72.0,"sigma_m":3.0,"state":"interpolated"},"peds":[],"vehs":[{"entity_id":"V1","x":56.6,"y":3.5,"yaw":3.1416,"cls":"car","dims":[4.5,1.8,1.5],"sigma_m":3.83}],"buildings":[{"bid":"w1001","u0":89.3,"u1":248.8},{"bid":"w1002","u0":355.1,"u1":382.1}]},{"t_ms":1400,"ego":{"lat":43.6487311,"lon":-79.3981678,"heading":72.0,"sigma_m":3.0,"state":"interpolated"},"peds":[],"vehs":[{"entity_id":"V1","x":54.8,"y":3.5,"yaw":3.1416,"cls":"car","dims":[4.5,1.8,1.5],"sigma_m":3.74}],"buildings":[{"bid":"w1001","u0":74.3,"u1":247.1},{"bid":"w1002","u0":355.5,"u1":383.4}]},{"t_ms":1500,"ego":{"lat":43.6487333,"lon":-79.3981583,"heading":72.0,"sigma_m":3.0,"state":"observed"},"peds":[],"vehs":[{"entity_id":"V1","x":53.0,"y":3.5,"yaw":3.1416,"cls":"car","dims":[4.5,1.8,1.5],"sigma_m":3.65}],"buildings":[{"bid":"w1001","u0":57.9,"u1":245.4},{"bid":"w1002","u0":356.0,"u1":384.8}]},{"t_ms":1600,"ego":{"lat":43.6487355,"lon":-79.3981489,"heading":72.0,"sigma_m":3.0,"state":"interpolated"},"peds":[],"vehs":[{"entity_id":"V1","x":51.2,"y":3.5,"yaw":3.1416,"cls":"car","dims":[4.5,1.8,1.5],"sigma_m":3.56}],"buildings":[{"bid":"w1001","u0":39.8,"u1":243.5},{"bid":"w1002","u0":356.4,"u1":386.2}]},{"t_ms":1700,"ego":{"lat":43.6487378,"lon":-79.3981394,"heading":72.0,"sigma_m":3.0,"state":"interpolated"},"peds":[],"vehs":[{"entity_id":"V1","x":49.4,"y":3.5,"yaw":3.1416,"cls":"car","dims":[4.5,1.8,1.5],"sigma_m":3.47}],"buildings":[{"bid":"w1001","u0":20.0,"u1":241.6},{"bid":"w1002","u0":356.8,"u1":387.6}]},{"t_ms":1800,"ego":{"lat":43.64874,"lon":-79.39813,"heading":72.0,"sigma_m":3.0,"state":"interpolated"},"peds":[],"vehs":[{"entity_id":"V1","x":47.6,"y":3.5,"yaw":3.1416,"cls":"car","dims":[4.5,1.8,1.5],"sigma_m":3.38}],"buildings":[{"bid":"w1001","u0":0.0,"u1":239.5},{"bid":"w1002","u0":357.3,"u1":389.2}]},{"t_ms":1900,"ego":{"lat":43.6487422,"lon":-79.3981205,"heading":72.0,"sigma_m":3.0,"state":"interpolated"},"peds":[],"vehs":[{"entity_id":"V1","x":45.8,"y":3.5,"yaw":3.1416,"cls":"car","dims":[4.5,1.8,1.5],"sigma_m":3.29}],"buildings":[{"bid":"w1001","u0":0.0,"u1":237.4},{"bid":"w1002","u0":357.8,"u1":390.8}]},{"t_ms":2000,"ego":{"lat":43.6487444,"lon":-79.3981111,"heading":72.0,"sigma_m":3.0,"state":"observed"},"peds":[],"vehs":[{"entity_id":"V1","x":44.0,"y":3.5,"yaw":3.1416,"cls":"car","dims":[4.5,1.8,1.5],"sigma_m":3.2}],"buildings":[{"bid":"w1001","u0":0.0,"u1":235.1},{"bid":"w1002","u0":358.2,"u1":392.4}]},{"t_ms":2100,"ego":{"lat":43.6487466,"lon":-79.3981016,"heading":72.0,"sigma_m":3.0,"state":"interpolated"},"peds":[],"vehs":[{"entity_id":"V1","x":42.2,"y":3.5,"yaw":3.1416,"cls":"car","dims":[4.5,1.8,1.5],"sigma_m":3.11}],"buildings":[{"bid":"w1001","u0":0.0,"u1":232.7},{"bid":"w1002","u0":358.7,"u1":394.2}]},{"t_ms":2200,"ego":{"lat":43.6487489,"lon":-79.3980922,"heading":72.0,"sigma_m":3.0,"state":"interpolated"},"peds":[],"vehs":[{"entity_id":"V1","x":40.4,"y":3.5,"yaw":3.1416,"cls":"car","dims":[4.5,1.8,1.5],"sigma_m":3.02}],"buildings":[{"bid":"w1001","u0":0.0,"u1":230.2},{"bid":"w1002","u0":359.2,"u1":396.0}]},{"t_ms":2300,"ego":{"lat":43.6487511,"lon":-79.3980827,"heading":72.0,"sigma_m":3.0,"state":"interpolated"},"peds":[],"vehs":[{"entity_id":"V1","x":38.6,"y":3.5,"yaw":3.1416,"cls":"car","dims":[4.5,1.8,1.5],"sigma_m":2.93}],"buildings":[{"bid":"w1001","u0":0.0,"u1":227.5},{"bid":"w1002","u0":359.7,"u1":397.9}]},{"t_ms":2400,"ego":{"lat":43.6487533,"lon":-79.3980733,"heading":72.0,"sigma_m":3.0,"state":"interpolated"},"peds":[],"vehs":[{"entity_id":"V1","x":36.8,"y":3.5,"yaw":3.1416,"cls":"car","dims":[4.5,1.8,1.5],"sigma_m":2.84}],"buildings":[{"bid":"w1001","u0":0.0,"u1":224.7},{"bid":"w1002","u0":360.3,"u1":400.0}]},{"t_ms":2500,"ego":{"lat":43.6487555,"lon":-79.3980639,"heading":72.0,"sigma_m":3.0,"state":"observed"},"peds":[],"vehs":[{"entity_id":"V1","x":35.0,"y":3.5,"yaw":3.1416,"cls":"car","dims":[4.5,1.8,1.5],"sigma_m":2.75}],"buildings":[{"bid":"w1001","u0":0.0,"u1":221.6},{"bid":"w1002","u0":360.8,"u1":402.1}]},{"t_ms":2600,"ego":{"lat":43.6487577,"lon":-79.3980544,"heading":72.0,"sigma_m":3.0,"state":"interpolated"},"peds":[],"vehs":[{"entity_id":"V1","x":33.2,"y":3.5,"yaw":3.1416,"cls":"car","dims":[4.5,1.8,1.5],"sigma_m":2.66}],"buildings":[{"bid":"w1001","u0":0.0,"u1":218.5},{"bid":"w1002","u0":361.4,"u1":404.3}]},{"t_ms":2700,"ego":{"lat":43.64876,"lon":-79.398045,"heading":72.0,"sigma_m":3.0,"state":"interpolated"},"peds":[],"vehs":[{"entity_id":"V1","x":31.4,"y":3.5,"yaw":3.1416,"cls":"car","dims":[4.5,1.8,1.5],"sigma_m":2.57}],"buildings":[{"bid":"w1001","u0":0.0,"u1":215.1},{"bid":"w1002","u0":362.0,"u1":406.7}]},{"t_ms":2800,"ego":{"lat":43.6487622,"lon":-79.3980355,"heading":72.0,"sigma_m":3.0,"state":"interpolated"},"peds":[],"vehs":[{"entity_id":"V1","x":29.6,"y":3.5,"yaw":3.1416,"cls":"car","dims":[4.5,1.8,1.5],"sigma_m":2.48}],"buildings":[{"bid":"w1001","u0":0.0,"u1":211.4},{"bid":"w1002","u0":362.5,"u1":409.2}]},{"t_ms":2900,"ego":{"lat":43.6487644,"lon":-79.3980261,"heading":72.0,"sigma_m":3.0,"state":"interpolated"},"peds":[],"vehs":[{"entity_id":"V1","x":27.8,"y":3.5,"yaw":3.1416,"cls":"car","dims":[4.5,1.8,1.5],"sigma_m":2.39}],"buildings":[{"bid":"w1001","u0":0.0,"u1":207.6},{"bid":"w1002","u0":363.2,"u1":411.8}]},{"t_ms":3000,"ego":{"lat":43.6487666,"lon":-79.3980166,"heading":72.0,"sigma_m":3.0,"state":"observed"},"peds":[{"entity_id":"P1","x":31.0,"y":-6.0,"h":1.7,"sigma_m":1.54,"kpts2d":[[379.4,150.7,0.8],[379.6,150.4,0.8],[379.5,150.4,0.8],[380.4,150.6,0.8],[380.1,150.6,0.8],[380.6,153.0,0.8],[379.8,153.0,0.8],[380.4,156.0,0.8],[379.6,156.0,0.8],[380.1,158.7,0.8],[379.3,158.7,0.8],[380.4,158.0,0.8],[380.0,158.0,0.8],[380.2,162.2,0.8],[379.7,162.2,0.8],[380.3,166.5,0.8],[379.9,166.4,0.8]],"source":"fisheye_ground"}],"vehs":[{"entity_id":"V1","x":26.0,"y":3.5,"yaw":3.1416,"cls":"car","dims":[4.5,1.8,1.5],"sigma_m":2.3}],"buildings":[{"bid":"w1001","u0":0.0,"u1":203.4},{"bid":"w1002","u0":363.8,"u1":414.6}]},{"t_ms":3100,"ego":{"lat":43.6487688,"lon":-79.3980072,"heading":72.0,"sigma_m":3.0,"state":"interpolated"},"peds":[{"entity_id":"P1","x":30.2,"y":-5.8,"h":1.7,"sigma_m":1.508,"kpts2d":[[379.1,150.6,0.8],[379.2,150.3,0.8],[379.1,150.3,0.8],[380.0,150.5,0.8],[379.7,150.5,0.8],[380.2,153.0,0.8],[379.5,153.0,0.8],[380.7,156.1,0.8],[378.6,156.0,0.8],[380.4,158.9,0.8],[378.2,158.8,0.8],[380.0,158.1,0.8],[379.6,158.1,0.8],[378.7,162.5,0.8],[380.4,162.4,0.8],[378.9,166.8,0.8],[380.6,166.7,0.8]],"source":"fisheye_ground"}],"vehs":[{"entity_id":"V1","x":24.2,"y":3.5,"yaw":3.1416,"cls":"car","dims":[4.5,1.8,1.5],"sigma_m":2.21}],"buildings":[{"bid":"w1001","u0":0.0,"u1":199.0},{"bid":"w1002","u0":364.4,"u1":417.6}]},{"t_ms":3200,"ego":{"lat":43.6487711,"lon":-79.3979977,"heading":72.0,"sigma_m":3.0,"state":"interpolated"},"peds":[{"entity_id":"P1","x":29.4,"y":-5.6,"h":1.7,"sigma_m":1.476,"kpts2d":[[378.6,150.